{
  "schema_version": "eino.connector_status.v1",
  "workspace_id": "ws-demo",
  "connector_id": "connector.fobrain.security",
  "status": "healthy",
  "credential_binding": {
    "schema_version": "eino.provider_credential_binding.v1",
    "workspace_id": "ws-demo",
    "system": "fobrain",
    "status": "bound",
    "display_ref": "bound:fobrain:workspace-binding",
    "owner_scope": "workspace",
    "updated_at": "2026-06-30T00:00:00Z",
    "audit_ref": "audit-credential-1"
  },
  "safe_summary": "Fobrain connector is configured.",
  "reason_code": "allowed",
  "checked_at": "2026-06-30T00:00:00Z",
  "audit_ref": "audit-connector-1"
}
